"","name","price","socket","form_factor","max_memory","memory_slots","color"
"1","MSI B650 GAMING PLUS WIFI",169.99,"AM5","ATX",192,4,"Black"
"2","Asus ROG STRIX B650-A GAMING WIFI",199.99,"AM5","ATX",192,4,"Black / Silver"
"3","MSI B760 GAMING PLUS WIFI",159.99,"LGA1700","ATX",192,4,"Black / Silver"
"4","MSI PRO Z790-A MAX WIFI",239.99,"LGA1700","ATX",192,4,"Silver / Black"
"5","MSI B550 GAMING GEN3",99.99,"AM4","ATX",128,4,"Black"
"6","MSI B450M-A PRO MAX II",69.98,"AM4","Micro ATX",64,2,"Black"
"7","MSI MAG B650 TOMAHAWK WIFI",199.99,"AM5","ATX",192,4,"Black"
"8","Gigabyte B650 GAMING X AX",179.99,"AM5","ATX",192,4,"Black / Gray"
"9","Asus PRIME B550M-A WIFI II",104.99,"AM4","Micro ATX",128,4,"Blue / Silver"
"10","ASRock B650M Pro RS WiFi",149.99,"AM5","Micro ATX",192,4,"Black / Silver"
"11","ASRock B660M Pro RS",94.99,"LGA1700","Micro ATX",128,4,"Gray / Black"
"12","MSI PRO B650M-P",119.99,"AM5","Micro ATX",192,4,"Black / Silver"
"13","Asus TUF GAMING Z790-PRO WIFI",279.99,"LGA1700","ATX",192,4,"Black"
"14","MSI MAG X670E TOMAHAWK WIFI",259.99,"AM5","ATX",192,4,"Black"
"15","MSI PRO Z790-P WIFI",199.99,"LGA1700","ATX",192,4,"Black / Silver"
"16","MSI MAG B550 TOMAHAWK MAX WIFI",159.99,"AM4","ATX",128,4,"Silver / Black"
"17","Asus ROG STRIX B550-F GAMING WIFI II",189.99,"AM4","ATX",128,4,"Black / Red"
"18","MSI PRO B650M-A WIFI",156.99,"AM5","Micro ATX",192,4,"Black"
"19","ASRock B650I Lightning Wifi",199.99,"AM5","Mini ITX",96,2,"Black"
"20","MSI B550M PRO-VDH WIFI",99.99,"AM4","Micro ATX",128,4,"Black"
"21","MSI PRO B650-S WIFI",139.99,"AM5","ATX",192,4,"Black"
"22","Gigabyte B650 EAGLE AX",169.99,"AM5","ATX",192,4,"Gray / Black"
"23","Asus ROG STRIX B650E-F GAMING WIFI",259.99,"AM5","ATX",192,4,"Black"
"24","Gigabyte B650 AORUS ELITE AX ICE",229.99,"AM5","ATX",192,4,"Silver"
"25","Asus ROG MAXIMUS Z790 DARK HERO",579.99,"LGA1700","ATX",192,4,"Black"
"26","Asus Prime B450M-A II",69.98,"AM4","Micro ATX",128,4,""
"27","Gigabyte B650 AORUS ELITE AX",199.99,"AM5","ATX",192,4,"Black / Silver"
"28","Asus PRIME B760-PLUS",129.99,"LGA1700","ATX",192,4,"Black / Silver"
"29","Gigabyte B550M K",94.99,"AM4","Micro ATX",128,4,"Brown / Silver"
"30","MSI MAG Z790 TOMAHAWK WIFI",209.99,"LGA1700","ATX",192,4,"Black"
"31","Gigabyte X670E AORUS PRO X",299.99,"AM5","ATX",192,4,"White / Silver"
"32","Asus ROG STRIX Z790-A GAMING WIFI II",335.99,"LGA1700","ATX",192,4,"Black / Silver"
"33","Gigabyte Z790 AORUS ELITE AX",219.99,"LGA1700","ATX",192,4,"Black"
"34","ASRock B450M-HDV R4.0",59.99,"AM4","Micro ATX",32,2,"Black / White"
"35","MSI PRO B550M-VC WIFI",116.55,"AM4","Micro ATX",128,4,"Black"
"36","MSI PRO B760-P WIFI DDR4",139.99,"LGA1700","ATX",128,4,"Black"
"37","Asus TUF GAMING B650-PLUS WIFI",199.99,"AM5","ATX",128,4,"Black"
"38","Gigabyte B550 UD AC",99.99,"AM4","ATX",128,4,"Brown / Black"
"39","Asus ROG STRIX B650E-I GAMING WIFI",299.99,"AM5","Mini ITX",96,2,"Black"
"40","Asus ROG STRIX Z790-E GAMING WIFI II",427.99,"LGA1700","ATX",192,4,"Black"
"41","MSI B550-A PRO",109.99,"AM4","ATX",128,4,"Black / Silver"
"42","MSI PRO A620M-E",74.95,"AM5","Micro ATX",96,2,"Black"
"43","MSI PRO H610M-G DDR4",79.99,"LGA1700","Micro ATX",64,2,"Black / Silver"
"44","ASRock B650M Pro RS",134.99,"AM5","Micro ATX",192,4,"Black / Silver"
"45","MSI PRO Z690-A WIFI",149.99,"LGA1700","ATX",192,4,"Black / Silver"
"46","Asus ROG STRIX B760-I GAMING WIFI",199.99,"LGA1700","Mini ITX",96,2,"Black"
"47","ASRock B550M Pro4",99.99,"AM4","Micro ATX",128,4,"Silver / Black"
"48","Gigabyte A520I AC",109.99,"AM4","Mini ITX",64,2,"Black"
"49","ASRock B450M/ac R2.0",77.66,"AM4","Micro ATX",128,4,"Black / Silver"
"50","MSI B450M PRO-VDH MAX",74.99,"AM4","Micro ATX",64,4,"Black / Silver"
"51","ASRock B760M-HDV/M.2",119.99,"LGA1700","Micro ATX",96,2,"White / Black"
"52","Gigabyte B760M DS3H DDR4",99.99,"LGA1700","Micro ATX",128,4,"Black"
"53","Asus TUF GAMING B550-PLUS WIFI II",134,"AM4","ATX",128,4,"Black / Gray"
"54","Gigabyte B650M D3HP",119.99,"AM5","Micro ATX",192,4,"Black"
"55","MSI PRO B650-P WIFI",162.99,"AM5","ATX",192,4,"Black"
"56","Asus ROG STRIX B550-A GAMING",171.99,"AM4","ATX",128,4,"Black / White"
"57","Asus TUF GAMING A520M-PLUS WIFI",97.99,"AM4","Micro ATX",128,4,"Black / Orange"
"58","Gigabyte B650 GAMING X AX V2",184.99,"AM5","ATX",192,4,"Gray / Black"
"59","Asus ROG STRIX X670E-E GAMING WIFI",449.99,"AM5","ATX",192,4,"Black / Silver"
"60","Asus ROG MAXIMUS Z790 FORMULA",749.99,"LGA1700","ATX",192,4,"Silver / Black"
"61","NZXT N7 B650E",279.99,"AM5","ATX",128,4,"White"
"62","ASRock Z690M-ITX/ax",134.99,"LGA1700","Mini ITX",64,2,"Silver / Black"
"63","Gigabyte B550M AORUS ELITE AX",99.99,"AM4","Micro ATX",128,4,"Black / Silver"
"64","MSI MPG B550 GAMING PLUS",131,"AM4","ATX",128,4,"Black"
"65","Gigabyte B550 AORUS ELITE AX V2",139.99,"AM4","ATX",128,4,"Black / Silver"
"66","ASRock A620I LIGHTNING WIFI",139.99,"AM5","Mini ITX",96,2,"Black"
"67","Gigabyte B650M AORUS ELITE AX",189.99,"AM5","Micro ATX",192,4,"Black"
"68","Gigabyte B450M DS3H WIFI",88.98,"AM4","Micro ATX",128,4,"Brown / Black"
"69","Asus TUF GAMING X570-PLUS (WI-FI)",193.99,"AM4","ATX",128,4,"Black / Gold"
"70","ASRock B760M-H/M.2",89.99,"LGA1700","Micro ATX",96,2,"Silver / Black"
"71","Asus TUF GAMING X670E-PLUS WIFI",269.99,"AM5","ATX",192,4,"Black / Orange"
"72","ASRock B650M-HDV/M.2",150.71,"AM5","Micro ATX",96,2,"Silver / Black"
"73","MSI MPG B650I EDGE WIFI",261.33,"AM5","Mini ITX",96,2,"Black / Silver"
"74","Gigabyte B650I AORUS ULTRA",259.99,"AM5","Mini ITX",96,2,"Black / Silver"
"75","Gigabyte B550 GAMING X V2",92.99,"AM4","ATX",128,4,"Black"
"76","MSI X670E GAMING PLUS WIFI",229.99,"AM5","ATX",192,4,"Silver / Black"
"77","ASRock B650M-H/M.2+",99.99,"AM5","Micro ATX",96,2,"Silver / Black"
"78","Asus ROG STRIX Z690-I GAMING WIFI",189.99,"LGA1700","Mini ITX",96,2,"Black / Silver"
"79","Gigabyte B450M K",80,"AM4","Micro ATX",64,2,"Brown / Silver"
"80","Gigabyte Z790 AORUS PRO X",349.99,"LGA1700","ATX",192,4,"Silver"
"81","MSI MAG B550 TOMAHAWK",139.99,"AM4","ATX",128,4,"Black / Silver"
"82","MSI MEG Z790 GODLIKE MAX",1196.99,"LGA1700","EATX",192,4,"Black"
"83","Gigabyte B650 AORUS ELITE AX V2",187.79,"AM5","ATX",192,4,"Black / Silver"
"84","ASRock A520M-HDV",66.98,"AM4","Micro ATX",64,2,"Black / Silver"
"85","MSI B450 Gaming Plus MAX",74.98,"AM4","ATX",128,4,"Red / Black"
"86","ASRock B550M-ITX/ac",129.99,"AM4","Mini ITX",64,2,"Silver / Black"
"87","ASRock B650 Steel Legend WiFi",179.99,"AM5","ATX",192,4,"White / Silver"
"88","Gigabyte A620I AX",139.99,"AM5","Mini ITX",96,2,"Black / Gray"
"89","Asus ROG STRIX Z690-E GAMING WIFI",230.99,"LGA1700","ATX",192,4,"Black"
"90","Asus PRIME X670-P WIFI",209.99,"AM5","ATX",192,4,"Silver / Black"
"91","MSI PRO B760M-P DDR4",99.99,"LGA1700","Micro ATX",128,4,"Black"
"92","Asus ROG CROSSHAIR X670E HERO",639.99,"AM5","ATX",192,4,"Black / Silver"
"93","Asus ROG STRIX Z790-E GAMING WIFI",359.99,"LGA1700","ATX",192,4,"Black"
"94","MSI MAG B760 TOMAHAWK WIFI",179.99,"LGA1700","ATX",192,4,"Black"
"95","Gigabyte H410M H V2",72.91,"LGA1200","Micro ATX",64,2,"Gray / Black"
"96","Asus TUF GAMING Z790-PLUS WIFI",229.99,"LGA1700","ATX",192,4,"Black / Gray"
"97","ASRock X670E Steel Legend",259.99,"AM5","ATX",192,4,"Black / White"
"98","Gigabyte B550I AORUS PRO AX",189.99,"AM4","Mini ITX",64,2,"Black / Silver"
"99","Gigabyte B650M D3HP AX",134.99,"AM5","Micro ATX",192,4,"Black / Gray"
"100","Gigabyte B760M DS3H AX",139.99,"LGA1700","Micro ATX",192,4,"Black"
"101","Gigabyte B550M DS3H AC",108.99,"AM4","Micro ATX",128,4,"Black"
"102","Gigabyte Z790 AORUS ELITE X WIFI7",279.99,"LGA1700","ATX",192,4,"Black"
"103","Asus PRIME Z790-P WIFI",189.99,"LGA1700","ATX",192,4,"Black / Silver"
"104","NZXT N7 B650E",249.99,"AM5","ATX",128,4,"Black"
"105","Asus ProArt X670E-CREATOR WIFI",424.99,"AM5","ATX",192,4,"Black / Copper"
"106","MSI B450 TOMAHAWK MAX",NA,"AM4","ATX",128,4,"Black"
"107","Gigabyte X670 AORUS ELITE AX (rev. 1.0)",269.99,"AM5","ATX",192,4,"Black"
"108","ASRock A620M Pro RS WiFi",177.85,"AM5","Micro ATX",192,4,"Silver / Black"
"109","ASRock B450M PRO4 R2.0",80.15,"AM4","Micro ATX",128,4,"Gray / Black"
"110","MSI PRO H610M-G WIFI DDR4",99,"LGA1700","Micro ATX",64,2,"Black / Silver"
"111","ASRock H610M-HVS",69.98,"LGA1700","Micro ATX",64,2,"Gray / Black"
"112","MSI MPG Z790 EDGE TI MAX WIFI",299.99,"LGA1700","ATX",192,4,"Silver / Black"
"113","ASRock B650E PG RIPTIDE WIFI",189.99,"AM5","ATX",192,4,"Black / Blue"
"114","MSI B650M GAMING PLUS WIFI",NA,"AM5","Micro ATX",192,4,"Silver / Black"
"115","ASRock Z690 Extreme",129.99,"LGA1700","ATX",128,4,"Black / Silver"
"116","Gigabyte Z790 EAGLE AX",183.94,"LGA1700","ATX",192,4,"Gray / Black"
"117","Gigabyte B650E AORUS ELITE X AX ICE",249.99,"AM5","ATX",192,4,"Silver / White"
"118","Gigabyte B550M DS3H",89,"AM4","Micro ATX",128,4,"Black / Gold"
"119","Asus ROG STRIX B650E-E GAMING WIFI",331.14,"AM5","ATX",192,4,"Black"
"120","Gigabyte B760 GAMING X AX",169.99,"LGA1700","ATX",192,4,"Black / Gray"
"121","Gigabyte A520M K V2",78.04,"AM4","Micro ATX",64,2,"Brown / Black"
"122","Asus ROG STRIX B550-F GAMING",158.99,"AM4","ATX",128,4,"Black"
"123","ASRock B550 Phantom Gaming 4/ac",89.99,"AM4","ATX",128,4,"Silver / Black"
"124","MSI PRO B760M-A WIFI DDR4",149.99,"LGA1700","Micro ATX",128,4,"Black"
"125","Asus TUF GAMING B760M-PLUS WIFI II",194.99,"LGA1700","Micro ATX",192,4,"Black / Orange"
"126","NZXT N7 Z790",NA,"LGA1700","ATX",192,4,"White / Black"
"127","Gigabyte B760I AORUS PRO",199.99,"LGA1700","Mini ITX",96,2,"Silver / Black"
"128","ASRock B650M PG RIPTIDE WIFI",169.99,"AM5","Micro ATX",192,4,"Black"
"129","Asus TUF GAMING B650M-PLUS WIFI",189.99,"AM5","Micro ATX",192,4,"Black"
"130","Asus ROG STRIX X670E-F GAMING WIFI",349.99,"AM5","ATX",192,4,"Black / Silver"
"131","Asus ProArt Z790-CREATOR WIFI",439.99,"LGA1700","ATX",192,4,"Black / Copper"
"132","Asus PRIME B650-PLUS",164.99,"AM5","ATX",192,4,"Black / Silver"
"133","MSI A520M-A PRO",69.99,"AM4","Micro ATX",64,2,"Black"
"134","NZXT N7 Z790",296.99,"LGA1700","ATX",192,4,"Black"
"135","ASRock B550M-HDV",74.98,"AM4","Micro ATX",64,2,"Black"
"136","ASRock B550M PG RIPTIDE",102.98,"AM4","Micro ATX",128,4,""
"137","Asus ROG STRIX X670E-I GAMING WIFI",424.99,"AM5","Mini ITX",96,2,"Black / Silver"
"138","Asus ROG STRIX B760-A GAMING WIFI",209.99,"LGA1700","ATX",192,4,"Silver / Black"
"139","Gigabyte X670 GAMING X AX V2",209.99,"AM5","ATX",192,4,"Black / Gray"
"140","Gigabyte A520M DS3H V2",89.2,"AM4","Micro ATX",128,4,"Gray / Brown"
"141","Asus ROG STRIX Z790-H GAMING WIFI",249.99,"LGA1700","ATX",192,4,"Black"
"142","MSI Z790 GAMING PLUS WIFI",199.99,"LGA1700","ATX",192,4,"Black"
"143","ASRock Z690 Pro RS",119.99,"LGA1700","ATX",128,4,"Silver / Black"
"144","Asus ROG STRIX Z790-F GAMING WIFI II",409.99,"LGA1700","ATX",192,4,"Black"
"145","MSI MEG X670E GODLIKE",1287.01,"AM5","EATX",192,4,"Black"
"146","Asus TUF GAMING B550M-PLUS WIFI II",202.34,"AM4","Micro ATX",128,4,"Black / Gray"
"147","MSI PRO Z790-S WIFI",169.99,"LGA1700","ATX",192,4,"Black"
"148","Asus ROG STRIX X670E-A GAMING WIFI",334.99,"AM5","ATX",192,4,"Silver / Black"
"149","ASRock H370M-HDV",74.95,"LGA1151-2","Micro ATX",64,2,"Black / Silver"
"150","ASRock B550 Phantom Gaming-ITX/ax",159.99,"AM4","Mini ITX",64,2,"Silver / Black"
"151","Asus PRIME B660M-A WIFI D4",171.27,"LGA1700","Micro ATX",128,4,"Silver / Black"
"152","MSI MAG B760M MORTAR WIFI II",179.99,"LGA1700","Micro ATX",192,4,"Silver / Black"
"153","Asus ROG STRIX Z790-A GAMING WIFI D4",219.99,"LGA1700","ATX",128,4,"Black / Silver"
"154","MSI MAG B650M MORTAR WIFI",199.95,"AM5","Micro ATX",192,4,"Black"
"155","MSI MPG Z790I EDGE WIFI",297.83,"LGA1700","Mini ITX",96,2,"Silver / Black"
"156","MSI PRO B550-VC",139.99,"AM4","ATX",128,4,"Black"
"157","Gigabyte Z790 AORUS ELITE AX ICE",259.99,"LGA1700","ATX",192,4,"Silver / White"
"158","Asus PRIME B550-PLUS",109.99,"AM4","ATX",128,4,"Black / White"
"159","ASRock B760M Pro RS/D4 WiFi",148.99,"LGA1700","Micro ATX",128,4,"Silver / Black"
"160","ASRock X670E PG Lightning",238.76,"AM5","ATX",192,4,"Black"
"161","Gigabyte A520M S2H",80.48,"AM4","Micro ATX",64,2,"Black"
"162","ASRock B550 Phantom Gaming 4",89.99,"AM4","ATX",128,4,"Silver / Black"
"163","MSI MAG Z790 TOMAHAWK MAX WIFI",269.99,"LGA1700","ATX",192,4,"Black / Yellow"
"164","MSI PRO-H610M-E-DDR4",91.11,"LGA1700","Micro ATX",64,2,"Black"
"165","Gigabyte H510M K V2",84.73,"LGA1200","Micro ATX",64,2,"Black / Gray"
"166","Asus PRIME Z790-A WIFI",249,"LGA1700","ATX",192,4,"Black / Silver"
"167","Asus PRIME A320M-K",68.98,"AM4","Micro ATX",32,2,"Black / White"
"168","Asus ROG STRIX B450-F GAMING II",NA,"AM4","ATX",128,4,"Black"
"169","MSI MPG X670E CARBON WIFI",409.99,"AM5","ATX",192,4,"Black"
"170","MSI B760M GAMING PLUS WIFI",NA,"LGA1700","Micro ATX",192,4,"Black / Silver"
"171","ASRock B650M PG Lightning Wifi",NA,"AM5","Micro ATX",192,4,"Silver / Black"
"172","Asus ROG MAXIMUS Z790 HERO",529.99,"LGA1700","ATX",192,4,"Black"
"173","ASRock B450M Steel Legend",89.99,"AM4","Micro ATX",64,4,"Black / White"
"174","Gigabyte Z790 AORUS ELITE X AX",229.99,"LGA1700","ATX",192,4,"Black"
"175","MSI MPG B650 EDGE WIFI",227.99,"AM5","ATX",192,4,"Black / Silver"
"176","Asus PRIME X670E-PRO WIFI",299.76,"AM5","ATX",192,4,"Silver / Black"
"177","ASRock B650 LiveMixer",138.99,"AM5","ATX",192,4,"Orange / Black"
"178","MSI PRO Z790-P WIFI DDR4",201.19,"LGA1700","ATX",128,4,"Black / Silver"
"179","Asus PRIME B650M-A WIFI II",226.56,"AM5","Micro ATX",192,4,"Black / Silver"
"180","Asus PRIME B550-PLUS AC-HES",109.99,"AM4","ATX",128,4,"Silver / Black"
"181","MSI PRO Z790-A WIFI",219.99,"LGA1700","ATX",192,4,"Black / Silver"
"182","Asus PRIME H510M-A WIFI",109.99,"LGA1200","Micro ATX",64,2,"Black / Silver"
"183","ASRock B760M PG SONIC WiFi",189.99,"LGA1700","Micro ATX",192,4,"Blue / Silver"
"184","Asus TUF GAMING A620M-PLUS WIFI",148.99,"AM5","Micro ATX",192,4,"Black / Orange"
"185","ASRock B650 PRO RS",244.21,"AM5","ATX",192,4,"Black / Silver"
"186","Gigabyte H610M S2H V2 DDR4",89.99,"LGA1700","Micro ATX",64,2,"Black / Gray"
"187","Gigabyte B650I AX",NA,"AM5","Mini ITX",96,2,"Black"
"188","Asus ROG STRIX Z790-I GAMING WIFI",439.99,"LGA1700","Mini ITX",96,2,"Black"
"189","MSI MAG B760 TOMAHAWK WIFI DDR4",179.99,"LGA1700","ATX",128,4,"Black"
"190","ASRock Fatal1ty B450 Gaming-ITX/ac",146.86,"AM4","Mini ITX",64,2,"Black / Silver"
"191","Asus ROG STRIX Z790-F GAMING WIFI",269.99,"LGA1700","ATX",192,4,"Black"
"192","ASRock Z790 Lightning WiFi",159.99,"LGA1700","ATX",192,4,"Silver / Black"
"193","Gigabyte X670E AORUS XTREME (rev. 1.0)",649.99,"AM5","EATX",192,4,"Black"
"194","ASRock B550M Steel Legend",115.98,"AM4","Micro ATX",128,4,"Silver / Black"
"195","Asus PRIME Z790-V WIFI",219.99,"LGA1700","ATX",192,4,"Black / Silver"
"196","NZXT N7 B550",NA,"AM4","ATX",128,4,"White / Black"
"197","Asus ROG STRIX B450-F GAMING",NA,"AM4","ATX",128,4,"Black"
"198","Gigabyte Z790M AORUS ELITE AX ICE",204.99,"LGA1700","Micro ATX",192,4,"White / Silver"
"199","MSI B450M-A PRO MAX",92.21,"AM4","Micro ATX",32,2,"Black"
"200","Gigabyte Z790 UD AC",189.99,"LGA1700","ATX",192,4,"Black"
"201","Asus ROG MAXIMUS Z790 APEX ENCORE",869.47,"LGA1700","ATX",96,2,"Black"
"202","ASRock B450M Pro4",NA,"AM4","Micro ATX",128,4,"Black / Silver"
"203","ASRock B650 PG LIGHTNING",149.99,"AM5","ATX",192,4,"Black"
"204","ASRock X670E Taichi",409.99,"AM5","EATX",192,4,"Black"
"205","Gigabyte B760 AORUS ELITE AX",169.99,"LGA1700","ATX",192,4,"Black"
"206","Gigabyte B450M DS3H",124.94,"AM4","Micro ATX",128,4,"Black / Silver"
"207","Gigabyte B550M AORUS ELITE",132.27,"AM4","Micro ATX",128,4,"Black / Orange"
"208","Gigabyte X670E AORUS MASTER (rev. 1.0)",391.71,"AM5","EATX",192,4,"Black / Silver"
"209","ASRock B650E Taichi Lite",259.99,"AM5","EATX",192,4,"Black / Gray"
"210","ASRock Z790 Riptide WiFi",199.99,"LGA1700","ATX",192,4,"Black"
"211","Asus TUF GAMING B760-PLUS WIFI",179.99,"LGA1700","ATX",192,4,"Black"
"212","Gigabyte Z790 GAMING X AX",199.99,"LGA1700","ATX",192,4,"Black"
"213","Gigabyte B650M GAMING X AX",214.86,"AM5","Micro ATX",192,4,"Black"
"214","ASRock B760M-HDV/M.2 D4",89.99,"LGA1700","Micro ATX",64,2,"Silver / Black"
"215","MSI MAG Z690 TOMAHAWK WIFI DDR4",NA,"LGA1700","ATX",128,4,"Black / Silver"
"216","Asus PRIME Z390-P",199.94,"LGA1151-2","ATX",128,4,"Silver / Black"
"217","MSI MPG Z790 CARBON WIFI II",399.99,"LGA1700","ATX",192,4,"Black"
"218","Gigabyte A620M S2H",89.99,"AM5","Micro ATX",96,2,"Gray / Black"
"219","ASRock B660M-HDV",94.99,"LGA1700","Micro ATX",64,2,"Gray / Black"
"220","MSI MPG B760I EDGE WIFI",206.61,"LGA1700","Mini ITX",96,2,"Black / Silver"
"221","MSI PRO B650M-B",NA,"AM5","Micro ATX",96,2,"Black"
"222","Asus ROG STRIX Z690-A GAMING WIFI D4",397.86,"LGA1700","ATX",128,4,"Silver / Black"
"223","Asus PRIME B760M-A",145.54,"LGA1700","Micro ATX",128,4,"Silver / Black"
"224","MSI MEG X670E ACE",679.99,"AM5","EATX",192,4,"Black / Gold"
"225","ASRock X670E Taichi Carrara",429.99,"AM5","EATX",192,4,"Black / White"
"226","MSI MEG Z790 ACE MAX",699.99,"LGA1700","EATX",192,4,"Black"
"227","MSI PRO Z690-A WIFI DDR4",189.99,"LGA1700","ATX",128,4,"Black / Silver"
"228","MSI Z390-A PRO",246.18,"LGA1151-2","ATX",128,4,"Brown / Black"
"229","Gigabyte B650M DS3H",193.53,"AM5","Micro ATX",192,4,"Brown / Black"
"230","Gigabyte B650M K",119.99,"AM5","Micro ATX",192,4,"Brown / Silver"
"231","ASRock H310CM-DVS",62.8,"LGA1151-2","Micro ATX",32,2,"Black"
"232","Asus PRIME B450M-K II",91.17,"AM4","Micro ATX",64,2,"Black"
"233","Asus TUF GAMING Z790-PLUS WIFI D4",199.99,"LGA1700","ATX",128,4,"Black"
"234","Gigabyte B550 AORUS ELITE V2",173.32,"AM4","ATX",128,4,"Black"
"235","Asus ROG Crosshair VIII Dark Hero",579.99,"AM4","ATX",128,4,"Black / Silver"
"236","Asus PRIME Z390-A",284,"LGA1151-2","ATX",128,4,"Silver / Black"
"237","ASRock Z790 Pro RS",169.99,"LGA1700","ATX",192,4,"Silver / Black"
"238","MSI PRO B760-VC WIFI IV",159.99,"LGA1700","ATX",256,4,"Black / Silver"
"239","MSI PRO Z790-VC WIFI",159.99,"LGA1700","ATX",192,4,"Black"
"240","Asus PRIME A520M-A II/CSM",79.99,"AM4","Micro ATX",128,4,"Silver / Black"
"241","MSI MPG B650 CARBON WIFI",458.47,"AM5","ATX",192,4,"Black"
"242","ASRock B450M/AC",82.38,"AM4","Micro ATX",64,4,"Black"
"243","ASRock A520M-ITX/ac",119.17,"AM4","Mini ITX",64,2,"Black / Silver"
"244","Gigabyte B650M AORUS ELITE AX ICE",NA,"AM5","Micro ATX",192,4,"Silver"
"245","MSI Z790 GAMING PRO WIFI",189.99,"LGA1700","ATX",192,4,"Black"
"246","Gigabyte B650 UD AC",169.99,"AM5","ATX",192,4,"Black / Gray"
"247","Asus PRIME B760M-A WIFI D4",188.54,"LGA1700","Micro ATX",128,4,"Silver / Black"
"248","Gigabyte Z390 AORUS PRO WIFI",298,"LGA1151-2","ATX",128,4,"Black / Silver"
"249","ASRock B550 Pro4",119.67,"AM4","ATX",128,4,"Silver / Black"
"250","Gigabyte H610I",119.99,"LGA1700","Mini ITX",64,2,"Black"
"251","MSI MAG B660 TOMAHAWK WIFI DDR4",235.49,"LGA1700","ATX",128,4,"Black / Silver"
"252","MSI MPG Z790 EDGE WIFI",291.94,"LGA1700","ATX",192,4,"Silver / Black"
"253","Asus PRIME H610I-PLUS D4-CSM",112.99,"LGA1700","Mini ITX",64,2,"Silver / Black"
"254","ASRock B760M Steel Legend WiFi",159.99,"LGA1700","Micro ATX",192,4,"Silver / Black"
"255","Asus PRIME B660-PLUS D4",149.02,"LGA1700","ATX",128,4,"Silver / Black"
"256","MSI MAG B550M MORTAR MAX WIFI",149.99,"AM4","Micro ATX",128,4,"Silver / Black"
"257","ASRock B760M Pro RS",NA,"LGA1700","Micro ATX",192,4,"Silver / Black"
"258","Asus ROG STRIX X570-E GAMING WIFI II",459,"AM4","ATX",128,4,"Black"
"259","Asus TUF GAMING B550-PLUS",157,"AM4","ATX",128,4,"Black"
"260","ASRock B650E PG-ITX WIFI",289.99,"AM5","Mini ITX",96,2,"Black / Red"
"261","Asus TUF GAMING B650-PLUS",260.54,"AM5","ATX",128,4,"Black / Orange"
"262","Asus PRIME X670-P",221.02,"AM5","ATX",192,4,"Silver / Black"
"263","MSI PRO B550M-P GEN3",103.6,"AM4","Micro ATX",128,4,"Black"
"264","MSI B450 TOMAHAWK",NA,"AM4","ATX",64,4,"Black / Silver"
"265","ASRock B760M PG Riptide",129.99,"LGA1700","Micro ATX",192,4,"Black / Blue"
"266","Gigabyte B760M AORUS ELITE AX",174.99,"LGA1700","Micro ATX",192,4,"Black / Silver"
"267","Asus PRIME H510M-K",129.06,"LGA1200","Micro ATX",64,2,"Black / Silver"
"268","ASRock Z690 PG Riptide",124.99,"LGA1700","ATX",128,4,"Black / Silver"
"269","MSI Z490-A PRO",329,"LGA1200","ATX",128,4,"Black / Silver"
"270","MSI PRO B760M-A WIFI",169.99,"LGA1700","Micro ATX",192,4,"Black"
"271","Asus PRIME H610M-K D4",107.39,"LGA1700","Micro ATX",64,2,"Silver / Black"
"272","Gigabyte B450M DS3H V2",102.84,"AM4","Micro ATX",128,4,"Black"
"273","MSI MEG Z690 ACE",223.99,"LGA1700","EATX",192,4,"Black / Gold"
"274","ASRock B450 Steel Legend",99.99,"AM4","ATX",64,4,"Black / Silver"
"275","ASRock B560M-HDV",129.99,"LGA1200","Micro ATX",64,2,"Silver / Black"
"276","Asus ROG STRIX Z590-E GAMING WIFI",349.63,"LGA1200","ATX",128,4,"Black"
"277","MSI MPG Z790 CARBON WIFI",439.56,"LGA1700","ATX",192,4,"Black"
"278","Gigabyte B760M C",139.99,"LGA1700","Micro ATX",192,4,"Brown / Gray"
"279","ASRock A520M-HVS",81.23,"AM4","Micro ATX",64,2,"Black / Silver"
"280","Gigabyte Z790 AORUS MASTER",439.99,"LGA1700","EATX",192,4,"Black / Silver"
"281","Gigabyte B450 AORUS ELITE V2",126.81,"AM4","ATX",128,4,"Black"
"282","Asus ROG CROSSHAIR X670E GENE",658.73,"AM5","Micro ATX",96,2,"Black / Silver"
"283","Gigabyte Z790 AORUS XTREME X",1611.9,"LGA1700","EATX",192,4,"Black"
"284","ASRock Z790 Taichi Lite",341.99,"LGA1700","EATX",192,4,"Black / Gray"
"285","Asus TUF GAMING B650M-E WIFI",227.53,"AM5","Micro ATX",192,4,"Black"
"286","Asus TUF GAMING Z690-PLUS WIFI",219.99,"LGA1700","ATX",192,4,"Black / Gray"
"287","ASRock Z690 Phantom Gaming 4/D5",129.99,"LGA1700","ATX",192,4,"Black / Silver"
"288","Asus PRIME Z490-P",199.99,"LGA1200","ATX",128,4,"Black / Silver"
"289","MSI MEG X570 UNIFY",NA,"AM4","ATX",128,4,"Black"
"290","ASRock B650E STEEL LEGEND WIFI",199.99,"AM5","ATX",192,4,"Black / Silver"
"291","ASRock B760 Pro RS/D4",149.5,"LGA1700","ATX",128,4,"Silver / Black"
"292","MSI PRO B760M-P",141.53,"LGA1700","Micro ATX",192,4,"Black"
"293","MSI MEG Z690 UNIFY",199.99,"LGA1700","ATX",192,4,"Black / Silver"
"294","Asus PRIME A520M-K",97.85,"AM4","Micro ATX",64,2,"Black / Silver"
"295","MSI PRO X670-P WIFI",349.99,"AM5","ATX",192,4,"Black / White"
"296","Asus ROG STRIX B760-F GAMING WIFI",247.94,"LGA1700","ATX",192,4,"Black"
"297","Asus PRIME Z790M-PLUS",196.99,"LGA1700","Micro ATX",192,4,"Silver / Black"
"298","ASRock Z690M Phantom Gaming 4",99.99,"LGA1700","Micro ATX",128,4,"Silver / Black"
"299","ASRock H610M-HDV/M.2+ D5",98.4,"LGA1700","Micro ATX",96,2,"White / Black"
"300","ASRock B760M-ITX/D4 WiFi",148.99,"LGA1700","Mini ITX",64,2,"Silver / Black"
"301","MSI MAG B560M MORTAR WIFI",240.28,"LGA1200","Micro ATX",128,4,"Black / White"
"302","MSI MPG X570 GAMING EDGE WIFI",299,"AM4","ATX",128,4,"Black / Silver"
"303","Asus TUF GAMING X670E-PLUS",353.13,"AM5","ATX",192,4,"Black / Orange"
"304","Asus TUF GAMING B660-PLUS WIFI D4",215.81,"LGA1700","ATX",128,4,"Yellow / Black"
"305","MSI MAG Z790 TOMAHAWK WIFI DDR4",265.75,"LGA1700","ATX",128,4,"Black"
"306","Asus PRIME B550M-K",114.97,"AM4","Micro ATX",128,4,"Black / White"
"307","ASRock X570 Phantom Gaming-ITX/TB3",299,"AM4","Mini ITX",64,2,"Black / Silver"
"308","MSI MPG Z690 EDGE WIFI DDR4",369,"LGA1700","ATX",128,4,"Black / Gray"
"309","Asus PROART B650-CREATOR",229.99,"AM5","ATX",192,4,"Black / Copper"
"310","Gigabyte B450 I AORUS PRO WIFI",195.03,"AM4","Mini ITX",64,2,"Black / Silver"
"311","MSI PRO Z790-A WIFI DDR4",194.99,"LGA1700","ATX",128,4,"Black / Silver"
"312","ASRock B760 Pro RS",149.99,"LGA1700","ATX",192,4,"Silver / Black"
"313","ASRock X670E Pro RS",219.99,"AM5","ATX",192,4,"Black"
"314","Gigabyte B760I AORUS PRO DDR4",189.99,"LGA1700","Mini ITX",64,2,"Black / Gray"
"315","Asus PRIME B450M-A",207.5,"AM4","Micro ATX",64,4,"Black"
"316","Asus TUF GAMING X570-PRO WIFI II",NA,"AM4","ATX",128,4,"Black"
"317","Gigabyte A620M GAMING X",119.99,"AM5","Micro ATX",192,4,"Brown / Gray"
"318","Asus PRIME B450-PLUS",130.96,"AM4","ATX",64,4,"Black / Silver"
"319","Asus ROG STRIX Z370-E GAMING",NA,"LGA1151-2","ATX",64,4,"Black / Silver"
"320","Gigabyte B760M D3H",144.99,"LGA1700","Micro ATX",192,4,"Black / Gray"
"321","Gigabyte Z790 AORUS MASTER X",499.99,"LGA1700","EATX",192,4,"Black"
"322","ASRock X570 Phantom Gaming 4S",3939.77,"AM4","ATX",128,4,"Black"
"323","ASRock Z790M-ITX WIFI",229.99,"LGA1700","Mini ITX",96,2,"Black"
"324","Asus TUF GAMING B450-PLUS II",135.58,"AM4","ATX",128,4,"Black"
"325","Gigabyte A620M GAMING X AX",127.55,"AM5","Micro ATX",192,4,"Brown / Gray"
"326","ASRock H670M-ITX/ax",165.99,"LGA1700","Mini ITX",64,2,"Silver / Black"
"327","Gigabyte B760 DS3H AC DDR4",139.99,"LGA1700","ATX",128,4,"Black"
"328","Asus ROG STRIX Z390-E GAMING",365,"LGA1151-2","ATX",128,4,"Black"
"329","Asus ROG STRIX B760-A GAMING WIFI D4",214.99,"LGA1700","ATX",128,4,"Silver / Black"
"330","Asus PRIME Z790-P WIFI D4",219.99,"LGA1700","ATX",128,4,"Black / Silver"
"331","ASRock Z690 Phantom Gaming-ITX/TB4",194.99,"LGA1700","Mini ITX",96,2,"Black / Red"
"332","Asus ROG STRIX B550-F GAMING (WI-FI)",329,"AM4","ATX",128,4,"Black"
"333","MSI MPG Z490 GAMING EDGE WIFI",NA,"LGA1200","ATX",128,4,"Black / Silver"
"334","Gigabyte Z790 AORUS PRO X WIFI7",349.99,"LGA1700","ATX",192,4,"Black"
"335","MSI MPG B760M EDGE TI WIFI",229.99,"LGA1700","Micro ATX",192,4,"Silver / Black"
"336","Gigabyte B450 AORUS PRO WIFI (rev. 1.0)",237.26,"AM4","ATX",64,4,"Black / Silver"
"337","Asus ROG STRIX B660-I GAMING WIFI",NA,"LGA1700","Mini ITX",96,2,"Black / Silver"
"338","ASRock Z790 Nova WiFi",NA,"LGA1700","ATX",192,4,"Black"
"339","Asus ROG STRIX B550-I GAMING",NA,"AM4","Mini ITX",64,2,"Black"
"340","Asus TUF GAMING B760M-PLUS WIFI D4",256.25,"LGA1700","Micro ATX",128,4,"Black / Orange"
"341","Asus PRIME B650M-A AX II",159.99,"AM5","Micro ATX",192,4,"Black / Silver"
"342","ASRock Z790 Steel Legend WiFi",229.99,"LGA1700","ATX",192,4,"Silver / Black"
"343","Gigabyte Z790I AORUS ULTRA",289.99,"LGA1700","Mini ITX",96,2,"Silver / Black"
