"","name","price","socket","form_factor","max_memory","memory_slots","color"
"695","MSI X370 GAMING PRO CARBON",NA,"AM4","ATX",64,4,"Black / Silver"
"696","MSI B560M PRO-VDH WIFI",NA,"LGA1200","Micro ATX",128,4,"Black"
"697","Asus ROG STRIX Z590-A GAMING WIFI",459,"LGA1200","ATX",128,4,"Silver / Black"
"698","Gigabyte Z690 AORUS ELITE AX",199.99,"LGA1700","ATX",192,4,"Black"
"699","Asus ROG Crosshair VIII Extreme",NA,"AM4","EATX",128,4,"Black"
"700","Gigabyte B760 GAMING X AX DDR4",204.72,"LGA1700","ATX",128,4,"Black"
"701","ASRock B450M Pro4-F",NA,"AM4","Micro ATX",64,4,"Black / Silver"
"702","ASRock X370 Pro4",110.73,"AM4","ATX",64,4,"Black / White"
"703","MSI H510M PRO",199.9,"LGA1200","Micro ATX",64,2,"Beige"
"704","Gigabyte Z370P D3",NA,"LGA1151-2","ATX",64,4,"Black / Silver"
"705","Gigabyte Z790 D DDR4",246.11,"LGA1700","ATX",128,4,"Black"
"706","Asus PRIME X370-PRO",NA,"AM4","ATX",64,4,"Black / White"
"707","Asus TUF GAMING B650M-E",NA,"AM5","Micro ATX",192,4,"Black"
"708","Asus TUF GAMING B550M-PLUS (WI-FI)",261.72,"AM4","Micro ATX",128,4,"Black"
"709","Asus PRIME H610M-K",NA,"LGA1700","Micro ATX",96,2,"Black"
"710","MSI MPG B550 GAMING CARBON WIFI",NA,"AM4","ATX",128,4,"Black / Silver"
"711","Asus PRIME Z690-P",NA,"LGA1700","ATX",192,4,"Silver / Black"
"712","Asus ROG STRIX B560-A GAMING WIFI",274,"LGA1200","ATX",128,4,"Black / Silver"
"713","Biostar B450NH",NA,"AM4","Mini ITX",64,2,"Black / Silver"
"714","Gigabyte B760M GAMING DDR4",133.34,"LGA1700","Micro ATX",64,2,"Black / Red"
"715","Asus PRIME B350M-A",NA,"AM4","Micro ATX",64,4,"Black / Silver"
"716","Gigabyte B360M DS3H",NA,"LGA1151-2","Micro ATX",64,4,"Silver / Black"
"717","Asus PRIME B650M-A II-CSM",162.4,"AM5","Micro ATX",192,4,"Silver / Black"
"718","Asus PRIME Z590-P",NA,"LGA1200","ATX",128,4,"Silver / Black"
"719","Asus ROG Crosshair VIII Impact",583.45,"AM4","Mini DTX",64,2,"Black"
"720","Asus ROG STRIX B760-G GAMING WIFI D4",NA,"LGA1700","Micro ATX",128,4,"Silver / Black"
"721","Gigabyte H610M S2H V2",NA,"LGA1700","Micro ATX",96,2,"Black / Silver"
"722","MSI MAG Z590 TOMAHAWK WIFI",NA,"LGA1200","ATX",128,4,"Black"
"723","Asus PRIME H310M-E",172.07,"LGA1151-2","Micro ATX",32,2,"Silver / Black"
"724","ASRock H310CM-HDV",149.99,"LGA1151-2","Micro ATX",32,2,"Black"
"725","Asus PRIME B550M-A (WI-FI)",209.5,"AM4","Micro ATX",128,4,"Black / White"
"726","Gigabyte B650M AORUS PRO AX",NA,"AM5","Micro ATX",192,4,"Black"
"727","ASRock AB350M Pro4",220.5,"AM4","Micro ATX",64,4,"Black / White"
"728","Asus PRIME B760M-A D4",NA,"LGA1700","Micro ATX",128,4,"Silver / Black"
"729","Gigabyte Z590 VISION G",349.69,"LGA1200","ATX",128,4,"Black / White"
"730","Gigabyte B360M HD3",NA,"LGA1151-2","Micro ATX",32,2,"Silver / Black"
"731","ASRock H470M-HVS",NA,"LGA1200","Micro ATX",64,2,"Black / Silver"
"732","MSI MAG B560 TOMAHAWK WIFI",NA,"LGA1200","ATX",128,4,"Black"
"733","Gigabyte X570 AORUS XTREME",766.9,"AM4","EATX",128,4,"Black / Silver"
"734","MSI MAG B660M MORTAR DDR4",242,"LGA1700","Micro ATX",128,4,"Black / Silver"
"735","Gigabyte B760 AORUS ELITE AX DDR4",246.31,"LGA1700","ATX",128,4,"Black / Silver"
"736","Gigabyte Z690 AORUS PRO",429.99,"LGA1700","ATX",192,4,"Black"
"737","ASRock Z690 Phantom Gaming 4",209.99,"LGA1700","ATX",128,4,"Black / Silver"
"738","Asus ROG MAXIMUS XII HERO (WI-FI)",519.99,"LGA1200","ATX",128,4,"Black"
"739","MSI B450I GAMING PLUS MAX WIFI",NA,"AM4","Mini ITX",64,2,"Black"
"740","Asus ROG STRIX Z690-A GAMING WIFI",NA,"LGA1700","ATX",192,4,"Black / Silver"
"741","MSI MPG Z390 GAMING PRO CARBON AC",NA,"LGA1151-2","ATX",128,4,"Black / Silver"
"742","Asus TUF B450M-PRO GAMING",NA,"AM4","Micro ATX",64,4,"Black"
"743","ASRock A520M Pro4",96.69,"AM4","Micro ATX",128,4,"Black / Silver"
"744","Gigabyte B450M AORUS ELITE",NA,"AM4","Micro ATX",128,4,"Black / Orange"
"745","Gigabyte Z790 AORUS ELITE AX-W",366.07,"LGA1700","ATX",192,4,"Silver / Black"
"746","Asus PRIME X670-P WIFI-CSM",NA,"AM5","ATX",192,4,"Silver / Black"
"747","MSI MPG Z590 GAMING CARBON WIFI",NA,"LGA1200","ATX",128,4,"Black"
"748","ASRock Z370 Extreme4",934.23,"LGA1151-2","ATX",64,4,"Black / Silver"
"749","Gigabyte X570S AORUS ELITE",NA,"AM4","ATX",128,4,"Black"
"750","ASRock B550 Extreme4",157.41,"AM4","ATX",128,4,"Blue / Black"
"751","Gigabyte Z690 AERO G DDR4",241.45,"LGA1700","ATX",128,4,"Black / Silver"
"752","Asus ROG STRIX Z390-I GAMING",NA,"LGA1151-2","Mini ITX",64,2,"Black / Silver"
"753","Asus TUF GAMING B760M-PLUS D4",NA,"LGA1700","Micro ATX",128,4,"Black / Orange"
"754","Gigabyte Z390 AORUS PRO",370.25,"LGA1151-2","ATX",128,4,"Black / Silver"
"755","Asus CROSSHAIR VI HERO",NA,"AM4","ATX",128,4,"Black"
"756","ASRock Z370 Pro4",NA,"LGA1151-2","ATX",64,4,"Black / Silver"
"757","Supermicro C9Z390-PGW",788.99,"LGA1151-2","ATX",128,4,"Black"
"758","Asus ProArt X570-CREATOR WIFI",NA,"AM4","ATX",128,4,"Black"
"759","Biostar B450MHP",NA,"AM4","Micro ATX",64,2,"Black / Silver"
"760","Asus PRO Q570M-C/CSM",164.99,"LGA1200","Micro ATX",128,4,"Green / Black"
"761","Gigabyte A520M DS3H",120.9,"AM4","Micro ATX",128,4,"Black"
"762","Asus PRIME A520M-R",NA,"AM4","Micro ATX",64,2,"Silver / Black"
"763","Asus ROG STRIX Z590-I GAMING WIFI",449,"LGA1200","Mini ITX",64,2,"Black"
"764","Asus ROG MAXIMUS Z790 APEX",NA,"LGA1700","ATX",96,2,"Silver / Black"
"765","Gigabyte B660 DS3H AC DDR4",NA,"LGA1700","ATX",128,4,"Black"
"766","Asus ROG Strix Z370-I Gaming",NA,"LGA1151-2","Mini ITX",32,2,"Black / Silver"
"767","MSI B360 GAMING PLUS",NA,"LGA1151-2","ATX",64,4,"Black / Red"
"768","Gigabyte Z790 AORUS ELITE DDR4",257.75,"LGA1700","ATX",128,4,"Black"
"769","Gigabyte Z490 AORUS ELITE AC",349.99,"LGA1200","ATX",128,4,"Black / Silver"
"770","MSI PRO B760-VC WIFI II",NA,"LGA1700","ATX",192,4,"Black"
"771","Asus TUF GAMING B760M-E D4",178.48,"LGA1700","Micro ATX",128,4,"Black / Orange"
"772","Gigabyte Z690 AORUS MASTER",NA,"LGA1700","EATX",192,4,"Black"
"773","MSI B450 Gaming Plus",NA,"AM4","ATX",64,4,"Red / Black"
"774","Gigabyte Z590 AORUS ELITE AX",NA,"LGA1200","ATX",128,4,"Black"
"775","Biostar B550MH",139.66,"AM4","Micro ATX",64,2,"Black"
"776","ASRock B660M-C",NA,"LGA1700","Micro ATX",128,4,"Black"
"777","Asus A620M-AYW WIFI",NA,"AM5","Micro ATX",96,2,"Silver / Black"
"778","Gigabyte X570S UD",NA,"AM4","ATX",128,4,"Black / Gray"
"779","Asus TUF X470-PLUS GAMING",NA,"AM4","ATX",64,4,"Black"
"780","MSI H410M PRO",NA,"LGA1200","Micro ATX",64,2,"Black / Silver"
"781","MSI B450-A PRO",NA,"AM4","ATX",64,4,"Brown / Black"
"782","Gigabyte H610M H",111.65,"LGA1700","Micro ATX",64,2,"Brown / Silver"
"783","ASRock B460M Pro4",NA,"LGA1200","Micro ATX",128,4,"Black / Silver"
"784","MSI PRO B660M-A WIFI",NA,"LGA1700","Micro ATX",192,4,"Black / Silver"
"785","Asus PRIME H570M-PLUS/CSM",199.99,"LGA1200","Micro ATX",128,4,"Black / Silver"
"786","Gigabyte Z490 VISION G",429.99,"LGA1200","ATX",128,4,"White / Black"
"787","MSI B460M-A PRO",NA,"LGA1200","Micro ATX",64,2,"Black"
"788","Asus PRIME A520M-E",NA,"AM4","Micro ATX",64,2,"Black"
"789","MSI X370 XPOWER GAMING TITANIUM",NA,"AM4","ATX",64,4,"Silver"
"790","Asus TUF B360M-PLUS GAMING",NA,"LGA1151-2","Micro ATX",64,4,"Silver / Orange"
"791","Asus TUF GAMING X570-PRO (WI-FI)",NA,"AM4","ATX",128,4,"Black / Gold"
"792","ASRock B760I Lightning WiFi",169.99,"LGA1700","Mini ITX",96,2,"Black"
"793","Asus PRIME B650M-A-CSM",161.81,"AM5","Micro ATX",128,4,"Silver / Black"
"794","Gigabyte X570 AORUS ULTRA",NA,"AM4","ATX",128,4,"Black / Silver"
"795","Gigabyte B660 GAMING X AX DDR4",174.63,"LGA1700","ATX",128,4,"Black"
"796","Asus TUF GAMING H670-PRO WIFI D4",199.99,"LGA1700","ATX",128,4,"Gray / Black"
"797","Asus Pro B650M-CT-CSM",149.99,"AM5","Micro ATX",192,4,"Green / Black"
"798","Asus TUF GAMING B760M-PLUS",207.61,"LGA1700","Micro ATX",192,4,"Black / Orange"
"799","Gigabyte B560M DS3H V2",NA,"LGA1200","Micro ATX",128,4,"Black"
"800","ASRock B550 Taichi",301.67,"AM4","ATX",128,4,"Gold / Black"
"801","MSI MAG X570S TORPEDO MAX",NA,"AM4","ATX",128,4,"Blue / Black"
"802","Asus Pro B760M-CT-CSM",129.99,"LGA1700","Micro ATX",192,4,"Green / Black"
"803","MSI MPG B760I EDGE WIFI DDR4",NA,"LGA1700","Mini ITX",64,2,"Silver / Black"
"804","MSI MPG Z590 GAMING PLUS",NA,"LGA1200","ATX",128,4,"Black"
"805","Asus ROG Crosshair VII Hero (Wi-Fi)",NA,"AM4","ATX",64,4,"Black"
"806","Asus ROG STRIX Z390-H GAMING",339.99,"LGA1151-2","ATX",128,4,"Black / Red"
"807","NZXT N5 Z690",239.99,"LGA1700","ATX",128,4,"Black"
"808","Asus TUF GAMING H770-PRO WIFI",NA,"LGA1700","ATX",192,4,"Black"
"809","MSI MEG X570 ACE",NA,"AM4","ATX",128,4,"Black / Silver"
"810","Gigabyte GA-AB350M-Gaming 3",NA,"AM4","Micro ATX",64,4,"Black / Red"
"811","Gigabyte B450 Gaming X",NA,"AM4","ATX",64,4,"Black / Red"
"812","ASRock H610M-H2/M.2 D5",NA,"LGA1700","Micro ATX",96,2,"Black / Silver"
"813","MSI PRO B660M-E DDR4",NA,"LGA1700","Micro ATX",64,2,"Black / Silver"
"814","Asus PRIME B560M-A AC",NA,"LGA1200","Micro ATX",128,4,"Black / Silver"
"815","Gigabyte Z590 AORUS ULTRA",389,"LGA1200","ATX",128,4,"Black"
"816","MSI MAG B460M MORTAR WIFI",NA,"LGA1200","Micro ATX",128,4,"Silver / Black"
"817","Gigabyte H310M S2H",NA,"LGA1151-2","Micro ATX",32,2,"Silver / Brown"
"818","MSI MPG B550I GAMING EDGE MAX WIFI",NA,"AM4","Mini ITX",64,2,"Black"
"819","Asus PRIME B760M-A WIFI-CSM",NA,"LGA1700","Micro ATX",128,4,"Silver / Black"
"820","MSI MAG B660M BAZOOKA DDR4",227.6,"LGA1700","Micro ATX",128,4,"Green / Black"
"821","ASRock X570M Pro4",NA,"AM4","Micro ATX",128,4,"Black / Silver"
"822","Asus STRIX X370-F GAMING",408.67,"AM4","ATX",64,4,"Black"
"823","ASRock H670 PG Riptide",149.99,"LGA1700","ATX",128,4,"Black"
"824","Gigabyte Z690 UD DDR4",223.14,"LGA1700","ATX",128,4,"Black"
"825","ASRock B660 Steel Legend",NA,"LGA1700","ATX",128,4,"Silver / Black"
"826","MSI B350M PRO-VDH",NA,"AM4","Micro ATX",64,4,"Brown / Black"
"827","ASRock A320M",NA,"AM4","Micro ATX",32,2,"Black / Silver"
"828","MSI MPG Z390I GAMING EDGE AC",NA,"LGA1151-2","Mini ITX",64,2,"Black / Silver"
"829","Asus EX-A320M-GAMING",NA,"AM4","Micro ATX",64,4,"Red / Black"
"830","ASRock B450M Steel Legend Pink",NA,"AM4","Micro ATX",128,4,"Black / Pink"
"831","Asus PRIME H410M-E",NA,"LGA1200","Micro ATX",64,2,"Black"
"832","ASRock B650M-C",NA,"AM5","Micro ATX",192,4,"Black"
"833","MSI Z590 PLUS",NA,"LGA1200","ATX",128,4,"Black / Silver"
"834","Gigabyte B550 AORUS MASTER",NA,"AM4","ATX",128,4,"Black / Silver"
"835","Asus PRIME H310M-K R2.0",NA,"LGA1151-2","Micro ATX",32,2,"Black"
"836","Biostar A520MH",NA,"AM4","Micro ATX",64,2,"Black / Silver"
"837","Gigabyte Z790 S WIFI DDR4 (rev. 1.1/1.2)",NA,"LGA1700","ATX",128,6,"Black"
"838","ASRock Z790I Lightning WiFi",259.99,"LGA1700","Mini ITX",96,2,"Black"
"839","ASRock H310CM-ITX/ac",NA,"LGA1151-2","Mini ITX",32,2,"Black / Silver"
"840","MSI Z370 GAMING PRO CARBON",NA,"LGA1151-2","ATX",64,4,"Black"
"841","Asus PRIME H310M-A R2.0",NA,"LGA1151-2","Micro ATX",32,2,"Black"
"842","Gigabyte B450M GAMING",NA,"AM4","Micro ATX",32,2,"Red / Black"
"843","Asus PRIME B460-PLUS",NA,"LGA1200","ATX",128,4,"Silver / Black"
"844","MSI B450M MORTAR",NA,"AM4","Micro ATX",64,4,"Black"
"845","Asus PRIME H310-PLUS",NA,"LGA1151-2","ATX",32,2,"Black"
"846","Gigabyte X570 UD",NA,"AM4","ATX",128,4,"Black / Silver"
"847","MSI Z370 TOMAHAWK",NA,"LGA1151-2","ATX",64,4,"Black / Gray"
"848","Gigabyte Z490I AORUS ULTRA",467.9,"LGA1200","Mini ITX",64,2,"Black / Silver"
"849","Gigabyte A520M AORUS ELITE",99.99,"AM4","Micro ATX",128,4,"Black / Orange"
"850","MSI MEG X570S ACE MAX",NA,"AM4","ATX",128,4,"Black"
"851","Gigabyte Z370 AORUS Gaming 7 (rev. 1.0)",NA,"LGA1151-2","ATX",64,4,"Black / Silver"
"852","Gigabyte B550 VISION D",NA,"AM4","ATX",128,4,"White / Black"
"853","MSI B350 GAMING PLUS",NA,"AM4","ATX",64,4,"Black / Red"
"854","ASRock Fatal1ty B450 GAMING K4",NA,"AM4","ATX",64,4,"Black / Silver"
"855","Asus PRIME H610M-E-CSM",NA,"LGA1700","Micro ATX",96,2,"Silver / Black"
"856","Gigabyte B550M AORUS PRO AX",NA,"AM4","Micro ATX",128,4,"Black / Silver"
"857","MSI MAG B760M MORTAR MAX WIFI DDR4",NA,"LGA1700","Micro ATX",128,4,"Silver / Black"
"858","Asus PRIME X670E-PRO WIFI-CSM",NA,"AM5","ATX",192,4,"Silver / Black"
"859","Gigabyte H610M H DDR4",103.6,"LGA1700","Micro ATX",64,2,"Black / Gray"
"860","Asus ROG Crosshair VII Hero",NA,"AM4","ATX",64,4,"Black"
"861","MSI B450M PRO-VDH",NA,"AM4","Micro ATX",64,4,"Brown"
"862","MSI PRO B660-A DDR4",NA,"LGA1700","ATX",128,4,"Black / Silver"
"863","Gigabyte Z590 AORUS MASTER",449.99,"LGA1200","ATX",128,4,"Black"
"864","Asus ROG STRIX Z490-I GAMING",NA,"LGA1200","Mini ITX",64,2,"Black"
"865","Asus PRIME H410M-K",180,"LGA1200","Micro ATX",64,2,"Black"
"866","Asus ROG STRIX X470-I GAMING",NA,"AM4","Mini ITX",32,2,"Black"
"867","Gigabyte GA-AB350M-DS3H",NA,"AM4","Micro ATX",64,4,"Black"
"868","Gigabyte Z790 D",NA,"LGA1700","ATX",192,4,"Black / Gray"
"869","Gigabyte H610M S2H DDR4",173,"LGA1700","Micro ATX",64,2,"Black / Gray"
"870","Gigabyte Z370 HD3 (rev. 1.0)",NA,"LGA1151-2","ATX",64,4,"Black / Gray"
"871","Gigabyte B550 AORUS PRO V2",NA,"AM4","ATX",128,4,"Black"
"872","ASRock Z690 STEEL LEGEND/D5",NA,"LGA1700","ATX",192,4,"Black / White"
"873","ASRock Z690 Taichi Razer Edition",NA,"LGA1700","ATX",192,4,"Black"
"874","ASRock B450M Pro4-F R2.0",159,"AM4","Micro ATX",128,4,"Black"
"875","Gigabyte Z590 AORUS XTREME",848.48,"LGA1200","EATX",128,4,"Black"
"876","ASRock B760M-H2/M.2",NA,"LGA1700","Micro ATX",96,2,"Black / Silver"
"877","MSI B550-A PRO (CEC)",NA,"AM4","ATX",128,4,"Black"
"878","MSI MPG Z590 GAMING EDGE WIFI",NA,"LGA1200","ATX",128,4,"Black"
"879","Asus PRIME B760M-A AX6",NA,"LGA1700","Micro ATX",192,4,"Silver / Black"
"880","ASRock H670M Pro RS",139.99,"LGA1700","Micro ATX",128,4,"Gray / Black"
"881","Gigabyte Z590 AORUS ELITE",324.03,"LGA1200","ATX",128,4,"Black"
"882","Asus ProArt B760-CREATOR",NA,"LGA1700","ATX",192,4,"Black / Copper"
"883","Asus PRO A520M-C II/CSM",91.13,"AM4","Micro ATX",64,2,"Green / Black"
"884","Gigabyte B760M GAMING AC DDR4",NA,"LGA1700","Micro ATX",64,2,"Black / Red"
"885","Asus ROG MAXIMUS XII FORMULA",654,"LGA1200","ATX",128,4,"Black"
"886","Asus ROG STRIX B360-F GAMING",NA,"LGA1151-2","ATX",64,4,"Black"
"887","Gigabyte Z390 DESIGNARE",NA,"LGA1151-2","ATX",128,4,"Black / Silver"
"888","MSI B560M-A PRO",NA,"LGA1200","Micro ATX",64,2,"Black"
"889","MSI H410M-A PRO",NA,"LGA1200","Micro ATX",64,2,"Black / Silver"
"890","ASRock B660 Pro RS",NA,"LGA1700","ATX",128,4,"Gray / Black"
"891","Biostar Z690 VALKYRIE",865.65,"LGA1700","ATX",192,4,"Black / Gray"
"892","Asus PRIME H770-PLUS",233.9,"LGA1700","ATX",192,4,"Silver / Black"
"893","MSI Z790 GAMING WIFI",NA,"LGA1700","ATX",192,4,"Black"
"894","MSI A320M PRO-VH PLUS",NA,"AM4","Micro ATX",32,2,"Brown / Black"
"895","MSI X470 GAMING PRO",NA,"AM4","ATX",64,4,"Black / Red"
"896","Asus TUF Z370 Plus Gaming",NA,"LGA1151-2","ATX",64,4,"Black / Yellow"
"897","MSI B450M BAZOOKA",NA,"AM4","Micro ATX",64,4,"Black / Silver"
"898","ASRock B560M Pro4",NA,"LGA1200","Micro ATX",128,4,"Silver / Black"
"899","Gigabyte GA-AX370M-DS3H",NA,"AM4","Micro ATX",64,4,"Black"
"900","MSI MPG Z390M GAMING EDGE AC",NA,"LGA1151-2","Micro ATX",128,4,"Black / Silver"
"901","Gigabyte B360N GSM",179.99,"LGA1151-2","Mini ITX",32,2,"Black"
"902","ASRock Z590M Pro4",249.99,"LGA1200","Micro ATX",128,4,"Black / Silver"
"903","ASRock Z390 Phantom Gaming-ITX/ac",NA,"LGA1151-2","Mini ITX",64,2,"Black / Silver"
"904","ASRock B760M Pro-A D4 WiFi",NA,"LGA1700","Micro ATX",128,4,"White / Black"
"905","Asus PRIME H610M-A D4",NA,"LGA1700","Micro ATX",64,2,"Silver / Black"
"906","Gigabyte B760M AORUS ELITE AX DDR4",NA,"LGA1700","Micro ATX",128,4,"Black / Silver"
"907","Gigabyte B360 AORUS Gaming 3 WIFI",NA,"LGA1151-2","ATX",64,4,"Black / Orange"
"908","Asus Z790 GAMING WIFI7",NA,"LGA1700","ATX",192,4,"Silver / Black"
"909","Asus PRIME Z690M-PLUS D4",NA,"LGA1700","Micro ATX",128,4,"Silver / Black"
"910","Asus PRIME A320M-A",119.99,"AM4","Micro ATX",64,4,"Black / Gray"
"911","ASRock B660M Phantom Gaming 4",NA,"LGA1700","Micro ATX",128,4,"Silver / Black"
"912","MSI PRO B660M-G DDR4",NA,"LGA1700","Micro ATX",64,2,"Black / Silver"
"913","MSI H310M PRO-M2 PLUS",NA,"LGA1151-2","Micro ATX",32,2,"Black"
"914","Asus Pro B560M-CT/CSM",199,"LGA1200","Micro ATX",128,4,"Green"
"915","Gigabyte B660 DS3H DDR4",203.34,"LGA1700","ATX",128,4,"Black"
"916","Asus PRIME H610M-D D4",115.96,"LGA1700","Micro ATX",64,2,"Silver / Black"
"917","Asus ROG STRIX B660-F GAMING WIFI",NA,"LGA1700","ATX",192,4,"Black"
"918","ASRock Z590 Phantom Gaming-ITX/TB4",349,"LGA1200","Mini ITX",64,2,"Black / Red"
"919","Gigabyte Z590 AORUS PRO AX",305.99,"LGA1200","ATX",128,4,"Black"
"920","Asus ROG STRIX Z490-A GAMING",NA,"LGA1200","ATX",128,4,"Black / Silver"
"921","Asus TUF GAMING B560-PLUS WIFI",NA,"LGA1200","ATX",128,4,"Black"
"922","MSI Z370 SLI PLUS",381.49,"LGA1151-2","ATX",64,4,"Black / Gray"
"923","MSI MEG Z390 ACE",600,"LGA1151-2","ATX",128,4,"Black / Silver"
"924","Asus PRIME Z370-A II",NA,"LGA1151-2","ATX",64,4,"Black / Silver"
"925","Biostar A620MP-E PRO",NA,"AM5","Micro ATX",192,4,"Black / Silver"
"926","Asus TUF GAMING B660M-PLUS D4",303.67,"LGA1700","Micro ATX",128,4,"Orange / Black"
"927","ASRock Z590-C/ac",NA,"LGA1200","ATX",128,4,"Black"
"928","Gigabyte B560 HD3",NA,"LGA1200","ATX",128,4,"Black / Gray"
"929","Asus TUF Z390-PRO GAMING",355.99,"LGA1151-2","ATX",128,4,"Black / Gold"
"930","Colorful CVN X570M GAMING FROZEN V14",NA,"AM4","Micro ATX",128,4,"White"
"931","Gigabyte H410M S2 V3",NA,"LGA1200","Micro ATX",64,2,"Black / Gray"
"932","Asus ROG STRIX Z490-F GAMING",NA,"LGA1200","ATX",128,4,"Black"
"933","Asus PRIME B650M-R",NA,"AM5","Micro ATX",96,2,"Silver / Black"
"934","ASRock H670 Steel Legend",165.99,"LGA1700","ATX",128,4,"Silver / Gray"
"935","Gigabyte B560M AORUS PRO AX",NA,"LGA1200","Micro ATX",128,4,"Black / Silver"
"936","Gigabyte B660M AORUS Pro AX DDR4",NA,"LGA1700","Micro ATX",128,4,"Black"
"937","MSI PRO B650-VC WIFI",NA,"AM5","ATX",192,4,"Black / Silver"
"938","Asus Pro B660M-C D4-CSM",129.99,"LGA1700","Micro ATX",128,4,"Green / Black"
"939","ASRock Z690 Steel Legend",NA,"LGA1700","ATX",128,4,"Silver / Black"
"940","NZXT N7 Z590",NA,"LGA1200","ATX",128,4,"Black"
"941","Asus ROG STRIX Z490-G GAMING (WI-FI)",NA,"LGA1200","Micro ATX",128,4,"Black"
"942","Asus ROG STRIX B560-F GAMING WIFI",NA,"LGA1200","ATX",128,4,"Black / Silver"
"943","MSI MEG Z490I UNIFY",NA,"LGA1200","Mini ITX",64,2,"Black / Silver"
"944","Gigabyte Z390 D",NA,"LGA1151-2","ATX",128,4,"Black / Silver"
"945","MSI MEG Z690 UNIFY-X",NA,"LGA1700","ATX",96,2,"Black / Silver"
"946","Gigabyte Z370 AORUS Gaming 5 (rev. 1.0)",NA,"LGA1151-2","ATX",64,4,"Black / Silver"
"947","MSI MAG Z690M MORTAR WIFI",NA,"LGA1700","Micro ATX",192,4,"Silver / Black"
"948","Gigabyte B550M S2H",NA,"AM4","Micro ATX",64,2,"Black / Silver"
"949","Asus ROG Strix Z370-H Gaming",NA,"LGA1151-2","ATX",64,4,"Black / Red"
"950","MSI X470 GAMING PRO CARBON",NA,"AM4","ATX",64,4,"Black / Silver"
"951","Gigabyte B460M DS3H",NA,"LGA1200","Micro ATX",128,4,"Black / Silver"
"952","MSI MEG B550 UNIFY",NA,"AM4","ATX",128,4,"Black / Silver"
"953","MSI MEG Z590 UNIFY",NA,"LGA1200","ATX",128,4,"Black"
"954","MSI MPG Z790 CARBON MAX WIFI",NA,"LGA1700","ATX",192,4,"Black"
"955","ASRock X370 KILLER SLI/ac",NA,"AM4","ATX",64,4,"Black / White"
"956","MSI B360M MORTAR",NA,"LGA1151-2","Micro ATX",64,4,"Black"
"957","Gigabyte B560M DS3H",NA,"LGA1200","Micro ATX",128,4,"Black"
"958","Gigabyte A620M H (rev. 1.0)",NA,"AM5","Micro ATX",96,2,"Black"
"959","ASRock B760M-C",NA,"LGA1700","Micro ATX",192,4,"Black / Silver"
"960","ASRock Z390 Extreme4",199.99,"LGA1151-2","ATX",128,4,"Black"
"961","Asus PRIME B650M-A II",NA,"AM5","Micro ATX",192,4,"Silver / Black"
"962","Gigabyte B450M H",NA,"AM4","Micro ATX",32,2,"Black"
"963","Asus PRIME X670-P-CSM",NA,"AM5","ATX",192,4,"Silver / Black"
"964","Gigabyte B660 AORUS Master DDR4",313.12,"LGA1700","ATX",128,4,"Black"
"965","Gigabyte GA-AB350N-Gaming WIFI (rev. 1.0)",NA,"AM4","Mini ITX",32,2,"Black / Red"
"966","NZXT N7 Z390",NA,"LGA1151-2","ATX",64,4,"White / Black"
"967","Gigabyte B550M AORUS PRO",NA,"AM4","Micro ATX",128,4,"Black / Silver"
"968","Biostar B660T-SILVER",NA,"LGA1700","Mini ITX",64,2,"Silver / Black"
"969","ASRock Z590 Pro4",NA,"LGA1200","ATX",128,4,"Black / Silver"
"970","ASRock H310M-HDV/M.2",199.99,"LGA1151-2","Micro ATX",32,2,"Black / Silver"
"971","Gigabyte Z590I AORUS ULTRA",509,"LGA1200","Mini ITX",64,2,"Black"
"972","Asus TUF GAMING B550M-ZAKU (WI-FI)",NA,"AM4","Micro ATX",128,4,"Black / Red"
"973","Gigabyte Z590I VISION D",NA,"LGA1200","Mini ITX",64,2,"Black / White"
"974","EVGA Z790 CLASSIFIED",NA,"LGA1700","EATX",128,4,"Black"
"975","Asus PRIME A620-PLUS WIFI6",NA,"AM5","ATX",192,4,"Silver / Black"
"976","ASRock A320M-ITX",NA,"AM4","Mini ITX",32,2,"Black / Silver"
"977","Asus ROG STRIX Z590-F GAMING WIFI",NA,"LGA1200","ATX",128,4,"Black / Silver"
"978","Asus PRIME H670-PLUS D4",246.89,"LGA1700","ATX",128,4,"Silver / Black"
"979","MSI MAG B660M MORTAR MAX WIFI DDR4",NA,"LGA1700","Micro ATX",128,4,"Black / Silver"
"980","MSI X370 GAMING PLUS",NA,"AM4","ATX",64,4,"Black / Red"
"981","MSI B360 GAMING ARCTIC",NA,"LGA1151-2","ATX",64,4,"White"
"982","MSI MPG Z490M GAMING EDGE WIFI",NA,"LGA1200","Micro ATX",128,4,"Black / Silver"
"983","MSI A320M PRO-VH",NA,"AM4","Micro ATX",64,2,"Brown / Black"
"984","MSI PRO B650-VC WIFI II",NA,"AM5","ATX",96,2,"Black / White"
"985","Gigabyte B560 AORUS PRO AX",294.89,"LGA1200","ATX",128,4,"Black"
"986","Asus Pro A620M-DASH-CSM",NA,"AM5","Micro ATX",96,2,"Green"
"987","Asus PRIME Z370-P II",NA,"LGA1151-2","ATX",64,4,"Silver / Black"
"988","ASRock B460M Pro4/ac",NA,"LGA1200","Micro ATX",128,4,"Silver / Black"
"989","Gigabyte X670 AORUS ELITE AX (rev. 1.1)",NA,"AM5","ATX",192,4,"Black"
"990","ASRock Z690 Extreme WiFi 6E",NA,"LGA1700","ATX",128,4,"Black / Blue"
"991","Gigabyte X470 AORUS GAMING 5 WIFI",NA,"AM4","ATX",64,4,"Black / Orange"
"992","ASRock X570 PG Velocita",NA,"AM4","ATX",128,4,"Black / Silver"
"993","Gigabyte Z390 M GAMING",NA,"LGA1151-2","Micro ATX",128,4,"Black / Red"
"994","ASRock B360M-HDV",NA,"LGA1151-2","Micro ATX",32,2,"Black / Silver"
"995","MSI MEG Z390 GODLIKE",NA,"LGA1151-2","EATX",128,4,"Black"
"996","MSI MPG Z590 GAMING FORCE",NA,"LGA1200","ATX",128,4,"Black"
"997","MSI MAG B760M MORTAR MAX WIFI",NA,"LGA1700","Micro ATX",192,4,"Silver / Black"
"998","Asus TUF GAMING B450M-PRO S",NA,"AM4","Micro ATX",128,4,"Black"
"999","ASRock Z490 Phantom Gaming-ITX/TB3",NA,"LGA1200","Mini ITX",64,2,"Black"
"1000","MSI MAG B460 TORPEDO",249.9,"LGA1200","ATX",128,4,"Black"
"1001","ASRock B560M Steel Legend",NA,"LGA1200","Micro ATX",128,4,"Silver / Black"
"1002","Gigabyte Z490 AORUS ELITE",327.91,"LGA1200","ATX",128,4,"Black / Silver"
"1003","Gigabyte Z690I AORUS ULTRA PLUS DDR4 (rev. 1.0)",NA,"LGA1700","Mini ITX",64,2,""
"1004","Asus TUF GAMING Z490-PLUS",NA,"LGA1200","ATX",128,4,"Black"
"1005","Gigabyte B660M AORUS ELITE AX DDR4",NA,"LGA1700","Micro ATX",128,4,"Black"
"1006","MSI B350I PRO AC",NA,"AM4","Mini ITX",32,2,"Brown / Black"
"1007","Gigabyte X470 AORUS GAMING 7 WIFI",NA,"AM4","ATX",64,4,"Black / Orange"
"1008","MSI PRO H610M-B DDR4",NA,"LGA1700","Micro ATX",64,2,"Black / Silver"
"1009","Asus Prime A320I-K",NA,"AM4","Mini ITX",32,2,"Black"
"1010","ASRock H410M-HDV/M.2",NA,"LGA1200","Micro ATX",64,2,"Black"
"1011","EVGA Z790 DARK K|NGP|N",NA,"LGA1700","EATX",64,2,"Black"
"1012","Asus ROG STRIX B560-G GAMING WIFI",NA,"LGA1200","Micro ATX",128,4,"Black / Silver"
"1013","Asus TUF GAMING B460-PLUS",NA,"LGA1200","ATX",128,4,"Black / Gold"
"1014","Gigabyte Z690 AORUS ELITE DDR4",249.99,"LGA1700","ATX",128,4,"Black / Silver"
"1015","Asus TUF Z390M-PRO GAMING (WI-FI)",NA,"LGA1151-2","Micro ATX",128,4,"Black / Gold"
"1016","Gigabyte GA-AB350-Gaming",NA,"AM4","ATX",64,4,"Black / Red"
"1017","MSI B350M MORTAR",NA,"AM4","Micro ATX",64,4,"Black / Red"
"1018","MSI MPG Z590M GAMING EDGE WIFI",NA,"LGA1200","Micro ATX",128,4,"Black"
"1019","MSI MAG B660 TOMAHAWK EVA e-PROJECT",NA,"LGA1700","ATX",192,4,"Purple / Black"
"1020","Gigabyte H370 AORUS Gaming 3 WIFI",NA,"LGA1151-2","ATX",64,4,"Black / Orange"
"1021","Gigabyte B550 AORUS PRO",NA,"AM4","ATX",128,4,"Black / Orange"
"1022","Gigabyte H310M H",NA,"LGA1151-2","Micro ATX",32,2,"Silver / Brown"
"1023","Asus ROG STRIX B450-E GAMING",NA,"AM4","ATX",64,4,"Black"
"1024","Gigabyte A520M DS3H AC",NA,"AM4","Micro ATX",128,4,"Black"
"1025","MSI PRO B550-P GEN3",NA,"AM4","ATX",128,4,"Brown / Black"
"1026","MSI H510I PRO WIFI",NA,"LGA1200","Mini ITX",64,2,"Black / Silver"
"1027","MSI B450M BAZOOKA V2",NA,"AM4","Micro ATX",64,4,"Black"
"1028","ASRock B760M PG Riptide Wifi",NA,"LGA1700","Micro ATX",192,4,"Black"
"1029","Asus ROG Maximus XIII Extreme",684.66,"LGA1200","EATX",128,4,"Silver / Black"
"1030","Gigabyte GA-AX370-Gaming K7",NA,"AM4","ATX",64,4,"Black"
"1031","ASRock AB350 Gaming-ITX/ac",NA,"AM4","Mini ITX",32,2,"Black / Red"
"1032","ASRock X470 Master SLI/AC",NA,"AM4","ATX",64,4,"Black / Silver"
"1033","Gigabyte B660 GAMING X DDR4",NA,"LGA1700","ATX",128,4,"Black"
"1034","Asus Pro WS X570-ACE",589,"AM4","ATX",128,4,"Black"
"1035","MSI B560M PRO-VDH",NA,"LGA1200","Micro ATX",128,4,"Black"
"1036","Biostar Z690A VALKYRIE",NA,"LGA1700","ATX",128,4,"Black / Gray"
"1037","MSI B360M PRO-VDH",NA,"LGA1151-2","Micro ATX",64,4,"Black"
"1038","ASRock A520M/ac",NA,"AM4","Micro ATX",64,2,"Black / Silver"
"1039","Asus PRIME H610M-A WIFI-CSM",NA,"LGA1700","Micro ATX",96,2,"Black"
"1040","Asus PRIME B560M-K",NA,"LGA1200","Micro ATX",64,2,"Silver / Black"
"1041","ASRock X470 Taichi",NA,"AM4","ATX",64,4,"Black / Silver"
"1042","MSI MEG X570 GODLIKE",NA,"AM4","EATX",128,4,"Black"
"1043","Asus Z590 WIFI GUNDAM EDITION",NA,"LGA1200","ATX",128,4,"Black / White"
"1044","Gigabyte B760 AORUS ELITE",267.5,"LGA1700","ATX",192,4,"Black"
"1045","ASRock B560 Pro4",NA,"LGA1200","ATX",128,4,"Silver / Black"
"1046","ASRock AB350M",NA,"AM4","Micro ATX",32,2,"Black / White"
